title,sentiment_compound,sentiment_positive,sentiment_neutral,sentiment_negative
Whoever created the tradition of not seeing the bride in the wedding dress beforehand saved countless husbands everywhere from hours of dress shopping and will forever be a hero to all men.,0.8126,0.225,0.775,0.0
"We laugh at dogs getting excited when they hear a bark on TV, but if TV was a nonstop stream of unintelligible noises and then someone suddenly spoke to you in your language, you'd be pretty fucking startled too.",0.7013,0.181,0.764,0.054
"When you're a kid, you don't realize you're also watching your mom and dad grow up.",0.0,0.0,1.0,0.0
"Dads probably bond with dogs so much because, in our society, men don't get shown a lot of affection but dogs give tons of affection regardless",0.7783,0.221,0.779,0.0
Being able to tolerate the sound of your own voice in a video is probably the highest form of self acceptance.,0.4588,0.13,0.87,0.0
"Girls don't compliment guys because they're likely to take it non-platonically, guys take it non-platonically because it happens so infrequently they don't know how to handle it",-0.3724,0.0,0.911,0.089
"If elevators hadn't been invented, all the CEOs and important people would have their offices on the first floor as a sign of status.",0.2023,0.073,0.927,0.0
"If EA suffers big enough losses from the backlash of Battlefront 2, and it all started because some guy couldn't unlock Vader, this will be the second time Anakin brought balance to something.",-0.7906,0.0,0.789,0.211
Being able to do well in high school without having to put in much effort is actually a big disadvantage later in life.,-0.1779,0.081,0.811,0.108
"During a nuclear explosion, there is a certain distance of the radius where all the frozen supermarket pizzas are cooked to perfection.",0.7003,0.225,0.775,0.0
Anxiety is like when video game combat music is playing but you can't find any enemies.,0.5487,0.319,0.533,0.148
Pavlov probably thought about feeding his dogs every time someone rang a bell.,0.0,0.0,1.0,0.0
"11 babies have been born in Antarctica, and none of them died as infants, meaning Antarctica has the lowest infant mortality rate at 0%",0.0834,0.106,0.799,0.094
"We do not check the refrigerator multiple times to find new food, we check to see if our standards have dropped enough to eat what was available.",0.0,0.0,1.0,0.0
"The sentence ""Don't objectify women"" has ""women"" as the object of the sentence.",0.1531,0.191,0.809,0.0
"Somebody at google was just like ""yea, just have someone drive down every road on fucking earth"".",0.3612,0.135,0.865,0.0
"College students don't want to go to graduation ceremonies, but they go to please their relatives, while relatives don't want to go but go to support the students; we should all just be honest and skip that ceremony and go out for pizza.",0.8887,0.213,0.739,0.048
"There is probably at least one white guy, adopted and raised in China, who speaks English with a Chinese accent and strangers just assume he's a total asshole",0.0,0.0,1.0,0.0
"Apparently, a lemon is not naturally occurring and is a hybrid developed by cross breeding a bitter orange and a citron. Life never gave us lemons; we invented them all by ourselves.",-0.4215,0.0,0.917,0.083
Being 35 and not wanting to work in the field for which you've prepared is like being half way through an RPG and realizing you've built out your skill tree all wrong and you can't respec and you can't make a new character and there will never be another video game again,0.0772,0.078,0.867,0.055
It would be cool if after you died you could see the top 5 times you almost died.,-0.5868,0.164,0.56,0.276
It kinda makes sense that the target audience for fidget spinners lost interest in them so quickly,0.1779,0.148,0.739,0.113
"Avatar, the highest grossing film of all time, seems to have made zero impact on culture. No one references the movie and no one really talks about it since it was released 10 years ago.",-0.5719,0.0,0.849,0.151
"A guy named ""Weird Al"" has had a 40+ year long career with no allegations of sexual impropriety.",-0.4404,0.0,0.804,0.196
"We all think of Gordon Ramsay as an extremely picky food critic/chef but if your life's work was cooking and you saw a narcissistic restaurant manager breaking health code violations and making horrible food, you'd be pretty angry too.",-0.8885,0.081,0.659,0.26
